{
  "run_id": "run-20260305-203815",
  "base_url": "http://localhost:3000",
  "scope_context": {
    "current_phase": "Future Phase: Production Refinement & Integration Cleanup",
    "in_scope_summary": "Production hardening of existing workflows: error recovery, missing controls, better state feedback, and clearer operator flows.",
    "out_of_scope_summary": "Net-new platform domains (user data knowledge graph, large net-new architecture, speculative services not present in current stack)."
  },
  "pages": [
    {
      "page_id": "home",
      "route": "/",
      "evidence": {
        "playwright_desktop_screenshot": ".planning/page-audit/run-20260305-203815/captures/playwright/home-desktop.png",
        "playwright_mobile_screenshot": ".planning/page-audit/run-20260305-203815/captures/playwright/home-mobile.png",
        "firecrawl_output_file": ".planning/page-audit/run-20260305-203815/captures/firecrawl/home.txt"
      },
      "current_state": {
        "primary_ctas": [
          "Run Search Sweep",
          "Open Assistant",
          "Inspect Jobs"
        ],
        "secondary_actions": [
          "Navigate to Search/Chat/Enrichment/Jobs/Onboarding/Settings/Approvals"
        ],
        "settings_options": [],
        "filters": [],
        "states_coverage": {
          "loading": false,
          "empty": false,
          "error": false,
          "success": true
        }
      },
      "gaps": [
        "Root route mirrors dashboard without onboarding context for first-time users.",
        "No explicit system health timestamp despite telemetry framing."
      ],
      "recommendations": [
        {
          "title": "Add live backend health + last-sync timestamp card",
          "type": "content_block",
          "user_value": "Gives immediate confidence that automation services are online before actions are started.",
          "complexity": "low",
          "dependencies": [
            "GET /health",
            "frontend dashboard card component"
          ],
          "scope_decision": "in_scope",
          "verification": {
            "scope_alignment": "pass",
            "technical_feasibility": "pass",
            "consistency_with_ia": "pass",
            "measurable_outcome": "pass"
          }
        },
        {
          "title": "Add quick-start checklist (Connect store, Run search, Start enrichment)",
          "type": "content_block",
          "user_value": "Reduces first-session drop-off by guiding operators to first successful workflow.",
          "complexity": "medium",
          "dependencies": [
            "onboarding status",
            "jobs/search counters"
          ],
          "scope_decision": "in_scope",
          "verification": {
            "scope_alignment": "pass",
            "technical_feasibility": "pass",
            "consistency_with_ia": "pass",
            "measurable_outcome": "pass"
          }
        }
      ]
    },
    {
      "page_id": "dashboard",
      "route": "/dashboard",
      "evidence": {
        "playwright_desktop_screenshot": ".planning/page-audit/run-20260305-203815/captures/playwright/dashboard-desktop.png",
        "playwright_mobile_screenshot": ".planning/page-audit/run-20260305-203815/captures/playwright/dashboard-mobile.png",
        "firecrawl_output_file": ".planning/page-audit/run-20260305-203815/captures/firecrawl/dashboard.txt"
      },
      "current_state": {
        "primary_ctas": [
          "Run Search Sweep",
          "Open Assistant",
          "Inspect Jobs"
        ],
        "secondary_actions": [
          "Sidebar navigation"
        ],
        "settings_options": [],
        "filters": [],
        "states_coverage": {
          "loading": false,
          "empty": false,
          "error": false,
          "success": true
        }
      },
      "gaps": [
        "KPI cards are static; no trend/change indicators.",
        "No CTA prioritization based on account readiness."
      ],
      "recommendations": [
        {
          "title": "Add KPI trend deltas (24h change and direction)",
          "type": "content_block",
          "user_value": "Helps users detect regressions without opening deeper pages.",
          "complexity": "medium",
          "dependencies": [
            "metrics endpoint with historical values"
          ],
          "scope_decision": "in_scope",
          "verification": {
            "scope_alignment": "pass",
            "technical_feasibility": "pass",
            "consistency_with_ia": "pass",
            "measurable_outcome": "pass"
          }
        },
        {
          "title": "Gate primary CTA by readiness and show blocked reason",
          "type": "state_feedback",
          "user_value": "Prevents dead-end clicks when prerequisites are missing.",
          "complexity": "low",
          "dependencies": [
            "auth/store readiness flags"
          ],
          "scope_decision": "in_scope",
          "verification": {
            "scope_alignment": "pass",
            "technical_feasibility": "pass",
            "consistency_with_ia": "pass",
            "measurable_outcome": "pass"
          }
        }
      ]
    },
    {
      "page_id": "chat",
      "route": "/chat",
      "evidence": {
        "playwright_desktop_screenshot": ".planning/page-audit/run-20260305-203815/captures/playwright/chat-desktop.png",
        "playwright_mobile_screenshot": ".planning/page-audit/run-20260305-203815/captures/playwright/chat-mobile.png",
        "firecrawl_output_file": ".planning/page-audit/run-20260305-203815/captures/firecrawl/chat.txt"
      },
      "current_state": {
        "primary_ctas": [
          "Send message",
          "Bulk SKUs"
        ],
        "secondary_actions": [
          "Session state banner",
          "Stream status indicators"
        ],
        "settings_options": [
          "Stream mode (sse/poll fallback)"
        ],
        "filters": [],
        "states_coverage": {
          "loading": true,
          "empty": true,
          "error": true,
          "success": true
        }
      },
      "gaps": [
        "Chat workspace shows Internal Server Error without inline recovery action.",
        "No explicit reconnect/reset session control when stream bootstrap fails."
      ],
      "recommendations": [
        {
          "title": "Add inline Retry Session bootstrap button in error banner",
          "type": "button",
          "user_value": "Lets users recover from transient 500s without full page refresh.",
          "complexity": "low",
          "dependencies": [
            "existing /api/v1/chat/sessions endpoint"
          ],
          "scope_decision": "in_scope",
          "verification": {
            "scope_alignment": "pass",
            "technical_feasibility": "pass",
            "consistency_with_ia": "pass",
            "measurable_outcome": "pass"
          }
        },
        {
          "title": "Add collapsible diagnostics panel (SSE state, last event id, fallback mode)",
          "type": "content_block",
          "user_value": "Speeds issue triage and reduces support back-and-forth.",
          "complexity": "medium",
          "dependencies": [
            "chat stream client telemetry"
          ],
          "scope_decision": "in_scope",
          "verification": {
            "scope_alignment": "pass",
            "technical_feasibility": "pass",
            "consistency_with_ia": "pass",
            "measurable_outcome": "pass"
          }
        }
      ]
    },
    {
      "page_id": "enrichment",
      "route": "/enrichment",
      "evidence": {
        "playwright_desktop_screenshot": ".planning/page-audit/run-20260305-203815/captures/playwright/enrichment-desktop.png",
        "playwright_mobile_screenshot": ".planning/page-audit/run-20260305-203815/captures/playwright/enrichment-mobile.png",
        "firecrawl_output_file": ".planning/page-audit/run-20260305-203815/captures/firecrawl/enrichment.txt"
      },
      "current_state": {
        "primary_ctas": [
          "Start dry-run"
        ],
        "secondary_actions": [
          "Profile/language/TTL selection"
        ],
        "settings_options": [
          "Supplier verified toggle"
        ],
        "filters": [
          "profile",
          "language",
          "quick",
          "standard",
          "deep",
          "de",
          "en"
        ],
        "states_coverage": {
          "loading": false,
          "empty": false,
          "error": false,
          "success": true
        }
      },
      "gaps": [
        "No preflight summary of expected impact before dry-run start.",
        "No visible recent-run history from the same workspace."
      ],
      "recommendations": [
        {
          "title": "Add dry-run preflight summary (estimated items, conflict count, policy blockers)",
          "type": "content_block",
          "user_value": "Improves confidence before launching long-running jobs.",
          "complexity": "medium",
          "dependencies": [
            "enrichment preflight API"
          ],
          "scope_decision": "in_scope",
          "verification": {
            "scope_alignment": "pass",
            "technical_feasibility": "pass",
            "consistency_with_ia": "pass",
            "measurable_outcome": "pass"
          }
        },
        {
          "title": "Add recent enrichment runs table with quick-open report action",
          "type": "navigation",
          "user_value": "Makes iterative tuning faster by reusing previous runs.",
          "complexity": "medium",
          "dependencies": [
            "jobs/enrichment run listing API"
          ],
          "scope_decision": "in_scope",
          "verification": {
            "scope_alignment": "pass",
            "technical_feasibility": "pass",
            "consistency_with_ia": "pass",
            "measurable_outcome": "pass"
          }
        }
      ]
    },
    {
      "page_id": "jobs",